{
  "$schema": "../../../../../esquemas/tema.schema.json",
  "id": "acusativo",
  "prefijo": "ACU",
  "orden": 3,
  "nombre_corto": "Acusativo",
  "titulo": "Acusativo (Akkusativ)",
  "resumen": "El caso del objeto directo: lo que recibe la acción del verbo.",
  "que_es": "En 'Ich sehe den Hund', el perro es lo que veo. Eso es el objeto directo y en alemán va en acusativo, lo que cambia su artículo si es masculino.",
  "como_reconocerlo": [
    "Responde a Wen? (¿a quién?) o Was? (¿qué?)",
    "Va con verbos como sehen, haben, kaufen, brauchen, lesen, besuchen",
    "Solo cambia el masculino: der → den, ein → einen"
  ],
  "errores_comunes": [
    "Cambiar también el femenino o el neutro: es 'Ich sehe die Katze', no 'den Katze'",
    "Creer que la primera palabra es el sujeto: en 'Den Film finde ich...' el sujeto es ich"
  ],
  "ejemplos": [
    {
      "original": "Ich kaufe einen Tisch.",
      "traduccion": "Compro una mesa."
    },
    {
      "original": "Den Film finde ich langweilig.",
      "traduccion": "La película me parece aburrida."
    }
  ],
  "ficha_principal": "tabla_articulos"
}
